{
  "schemaVersion": 2,
  "taskCode": "npqs_certificate_fee_confirm_payment",
  "workflow": "npqs_payment_confirm",
  "meta": {
    "title": "NPQS Phytosanitary Certificate Fee Payment Confirmation",
    "description": "Officer confirms the trader has paid the Phytosanitary Certificate Fee (LKR 2000.00) outside GovPay."
  }
}
