{
  "schemaVersion": 2,
  "taskCode": "cda_kcfn_asycuda_verification_v1",
  "workflow": "cda_kcfn_asycuda_verification_v1",
  "meta": {
    "title": "CDA Officer ASYCUDA Green Check Verification",
    "description": "Officer verifies the recommendation letter alongside the trader's uploaded commercial invoice, packing list, and supporting documents, confirms the ASYCUDA green check, and marks the record as checked on the agency side.",
    "category": "CDA"
  }
}
