{
  "schemaVersion": 2,
  "taskCode": "npqs_treatment_fee_review_receipt",
  "workflow": "npqs_payment_review_receipt",
  "meta": {
    "title": "NPQS Treatment Fee Receipt Verification",
    "description": "Officer verifies the payment receipt the trader uploaded for the Treatment Fee (LKR 4500.00)."
  }
}
